{
  "asset": {
    "assetVersion": 1,
    "builtAt": "2026-09-21T06:20:56.958791Z",
    "chapterCount": 1,
    "contentSha256": "412c9e889683c5ff77e42ce1b71e8f99fcc247d52ef68793fc319d652152f9d7",
    "normalizerVersion": "0.2.0",
    "path": "books/as/sankardev-harishchandra-upakhyan-ed-1.as.wikisource/v1/book.json.gz",
    "sha256": "cd1fddca964673f48b18d77868693fdec3844452a20d802843f005a068330836",
    "sizeBytes": 45603,
    "uncompressedSizeBytes": 215100,
    "wordCount": 13420
  },
  "edition": {
    "editionId": "sankardev-harishchandra-upakhyan-ed-1.as.wikisource",
    "kind": "original",
    "language": "as",
    "title": "হৰিশ্চন্দ্ৰ উপাখ্যান"
  },
  "genres": [
    "Other"
  ],
  "publish": {
    "assetVersion": 1
  },
  "rights": {
    "basis": [
      "author died 1569: more than 70 years ago in every life-plus-70 jurisdiction",
      "first published 1906: more than 95 years ago (US term expired)"
    ],
    "evidence": [
      "https://www.wikidata.org/wiki/Q135932920",
      "https://www.wikidata.org/wiki/Q3116915",
      "https://as.wikisource.org/wiki/%E0%A6%B9%E0%A7%B0%E0%A6%BF%E0%A6%B6%E0%A7%8D%E0%A6%9A%E0%A6%A8%E0%A7%8D%E0%A6%A6%E0%A7%8D%E0%A7%B0_%E0%A6%89%E0%A6%AA%E0%A6%BE%E0%A6%96%E0%A7%8D%E0%A6%AF%E0%A6%BE%E0%A6%A8"
    ],
    "jurisdictions": [
      "worldwide-conservative"
    ],
    "notes": "Batch import: death years from the provider agent records and Wikidata, publication year from the cited Wikidata item or the imprint recorded by the provider; checked by the rights policy in tools/lib/src/rights_policy.dart.",
    "statement": "Public domain worldwide. শংকৰদেৱ died in 1569 and the work was first published in 1906. Source: as.wikisource.org transcription of the public-domain text.",
    "status": "public-domain",
    "verifiedAt": "2026-09-21",
    "verifiedBy": "arkanmgerges"
  },
  "schemaVersion": 1,
  "source": {
    "format": "html",
    "identifier": "হৰিশ্চন্দ্ৰ উপাখ্যান",
    "pages": [
      {
        "revision": 90062,
        "title": "হৰিশ্চন্দ্ৰ উপাখ্যান"
      }
    ],
    "provider": "wikisource",
    "retrievedAt": "2026-09-21T01:54:55.579589Z",
    "revision": "90062",
    "site": "as.wikisource.org",
    "url": "https://as.wikisource.org/wiki/%E0%A6%B9%E0%A7%B0%E0%A6%BF%E0%A6%B6%E0%A7%8D%E0%A6%9A%E0%A6%A8%E0%A7%8D%E0%A6%A6%E0%A7%8D%E0%A7%B0_%E0%A6%89%E0%A6%AA%E0%A6%BE%E0%A6%96%E0%A7%8D%E0%A6%AF%E0%A6%BE%E0%A6%A8"
  },
  "work": {
    "author": {
      "birthYear": 1449,
      "deathYear": 1569,
      "name": "শংকৰদেৱ",
      "wikidata": "Q3116915"
    },
    "originalLanguage": "as",
    "originalPublicationYear": 1906,
    "originalTitle": "হৰিশ্চন্দ্ৰ উপাখ্যান",
    "workId": "sankardev-harishchandra-upakhyan-ed-1"
  }
}
