{
  "asset": {
    "assetVersion": 1,
    "builtAt": "2026-09-21T06:21:14.817507Z",
    "chapterCount": 38,
    "contentSha256": "2a9df719c046228c2655089326ba108c5fbdc6b6aaa18669078708dfed706a53",
    "normalizerVersion": "0.2.0",
    "path": "books/bg/parlichev-autobiography-of-grigor-parlichev.bg.wikisource/v1/book.json.gz",
    "sha256": "3186e6ff15e04e3cb04f7575b703b60414f812c04522e0020aa4018391817285",
    "sizeBytes": 72038,
    "uncompressedSizeBytes": 254351,
    "wordCount": 24078
  },
  "edition": {
    "editionId": "parlichev-autobiography-of-grigor-parlichev.bg.wikisource",
    "kind": "original",
    "language": "bg",
    "title": "Автобиография на Григор Пърличев"
  },
  "genres": [
    "Biography"
  ],
  "publish": {
    "assetVersion": 1
  },
  "rights": {
    "basis": [
      "author died 1893: more than 70 years ago in every life-plus-70 jurisdiction",
      "first published 1894: more than 95 years ago (US term expired)"
    ],
    "evidence": [
      "https://www.wikidata.org/wiki/Q17130630",
      "https://www.wikidata.org/wiki/Q1363141",
      "https://bg.wikisource.org/wiki/%D0%90%D0%B2%D1%82%D0%BE%D0%B1%D0%B8%D0%BE%D0%B3%D1%80%D0%B0%D1%84%D0%B8%D1%8F_%D0%BD%D0%B0_%D0%93%D1%80%D0%B8%D0%B3%D0%BE%D1%80_%D0%9F%D1%8A%D1%80%D0%BB%D0%B8%D1%87%D0%B5%D0%B2"
    ],
    "jurisdictions": [
      "worldwide-conservative"
    ],
    "notes": "Batch import: death years from the provider agent records and Wikidata, publication year from the cited Wikidata item or the imprint recorded by the provider; checked by the rights policy in tools/lib/src/rights_policy.dart.",
    "statement": "Public domain worldwide. Григор Пърличев died in 1893 and the work was first published in 1894. Source: bg.wikisource.org transcription of the public-domain text.",
    "status": "public-domain",
    "verifiedAt": "2026-09-21",
    "verifiedBy": "arkanmgerges"
  },
  "schemaVersion": 1,
  "source": {
    "format": "html",
    "identifier": "Автобиография на Григор Пърличев",
    "pages": [
      {
        "revision": 11372,
        "title": "Автобиография на Григор Пърличев"
      }
    ],
    "provider": "wikisource",
    "retrievedAt": "2026-09-21T01:58:45.484699Z",
    "revision": "11372",
    "site": "bg.wikisource.org",
    "url": "https://bg.wikisource.org/wiki/%D0%90%D0%B2%D1%82%D0%BE%D0%B1%D0%B8%D0%BE%D0%B3%D1%80%D0%B0%D1%84%D0%B8%D1%8F_%D0%BD%D0%B0_%D0%93%D1%80%D0%B8%D0%B3%D0%BE%D1%80_%D0%9F%D1%8A%D1%80%D0%BB%D0%B8%D1%87%D0%B5%D0%B2"
  },
  "work": {
    "author": {
      "birthYear": 1830,
      "deathYear": 1893,
      "name": "Григор Пърличев",
      "wikidata": "Q1363141"
    },
    "originalLanguage": "bg",
    "originalPublicationYear": 1894,
    "originalTitle": "Автобиография на Григор Пърличев",
    "workId": "parlichev-autobiography-of-grigor-parlichev"
  }
}
