{
  "asset": {
    "assetVersion": 1,
    "builtAt": "2026-09-21T06:59:47.987979Z",
    "chapterCount": 8,
    "contentSha256": "e8359548bdf55003a8127e93abb7e79ada8ff618b4b0a051719a7fe56f4a4eca",
    "normalizerVersion": "0.2.0",
    "path": "books/it/engels-il-manifesto-del-partito-comunista-1891-italian.it.wikisource/v1/book.json.gz",
    "sha256": "71177c684fae545558a861a46985d14f4b61bd00d8a44e8ee8cd183e30e46fe0",
    "sizeBytes": 26442,
    "uncompressedSizeBytes": 81553,
    "wordCount": 11063
  },
  "edition": {
    "editionId": "engels-il-manifesto-del-partito-comunista-1891-italian.it.wikisource",
    "kind": "translation",
    "language": "it",
    "title": "Il Manifesto del Partito Comunista",
    "translationPublicationYear": 1891,
    "translator": {
      "birthYear": 1865,
      "deathYear": 1911,
      "name": "Pietro Gori",
      "wikidata": "Q607278"
    }
  },
  "genres": [
    "Other"
  ],
  "publish": {
    "assetVersion": 1
  },
  "rights": {
    "basis": [
      "author died 1895: more than 70 years ago in every life-plus-70 jurisdiction",
      "translator died 1911: more than 70 years ago in every life-plus-70 jurisdiction",
      "translation first published 1891: more than 95 years ago (US term expired)"
    ],
    "evidence": [
      "https://www.wikidata.org/wiki/Q40591",
      "https://www.wikidata.org/wiki/Q19759114",
      "https://www.wikidata.org/wiki/Q34787",
      "https://www.wikidata.org/wiki/Q607278",
      "https://it.wikisource.org/wiki/Il_Manifesto_del_Partito_Comunista"
    ],
    "jurisdictions": [
      "worldwide-conservative"
    ],
    "notes": "Batch import: death years from the provider agent records and Wikidata, publication year from the cited Wikidata item or the imprint recorded by the provider; checked by the rights policy in tools/lib/src/rights_policy.dart.",
    "statement": "Public domain worldwide. Friedrich Engels died in 1895; the translator Pietro Gori died in 1911 and this translation was first published in 1891. Source: it.wikisource.org transcription.",
    "status": "public-domain",
    "verifiedAt": "2026-09-21",
    "verifiedBy": "arkanmgerges"
  },
  "schemaVersion": 1,
  "source": {
    "format": "html",
    "identifier": "Il Manifesto del Partito Comunista",
    "pages": [
      {
        "revision": 3701457,
        "title": "Il Manifesto del Partito Comunista"
      },
      {
        "revision": 3701458,
        "title": "Il Manifesto del Partito Comunista/Ai lettori"
      },
      {
        "revision": 3701466,
        "title": "Il Manifesto del Partito Comunista/Prefazione"
      },
      {
        "revision": 3701459,
        "title": "Il Manifesto del Partito Comunista/I"
      },
      {
        "revision": 3701460,
        "title": "Il Manifesto del Partito Comunista/II"
      },
      {
        "revision": 3701461,
        "title": "Il Manifesto del Partito Comunista/III"
      },
      {
        "revision": 3701462,
        "title": "Il Manifesto del Partito Comunista/III/1"
      },
      {
        "revision": 3701463,
        "title": "Il Manifesto del Partito Comunista/III/2"
      },
      {
        "revision": 3701464,
        "title": "Il Manifesto del Partito Comunista/III/3"
      },
      {
        "revision": 3701465,
        "title": "Il Manifesto del Partito Comunista/III/4"
      }
    ],
    "provider": "wikisource",
    "retrievedAt": "2026-09-21T03:45:25.341754Z",
    "revision": "3701457",
    "site": "it.wikisource.org",
    "url": "https://it.wikisource.org/wiki/Il_Manifesto_del_Partito_Comunista"
  },
  "work": {
    "author": {
      "birthYear": 1820,
      "deathYear": 1895,
      "name": "Friedrich Engels",
      "wikidata": "Q34787"
    },
    "originalLanguage": "de",
    "originalPublicationYear": 1848,
    "originalTitle": "Il Manifesto del Partito Comunista (1891 Italian edition)",
    "workId": "engels-il-manifesto-del-partito-comunista-1891-italian"
  }
}
