{
  "asset": {
    "assetVersion": 1,
    "builtAt": "2026-09-21T06:56:25.922569Z",
    "chapterCount": 20,
    "contentSha256": "5b48151d31c8c613cacc54255705891296ab54175816ca7208d7ebd042854fc4",
    "normalizerVersion": "0.2.0",
    "path": "books/fi/gallen-kallela-kallela-kirja-i.fi.gutenberg/v1/book.json.gz",
    "sha256": "3fc48c0654e1d22453f8d8867a130d915e15603965bc77d1d2a1171f697976e5",
    "sizeBytes": 83588,
    "uncompressedSizeBytes": 211170,
    "wordCount": 23524
  },
  "edition": {
    "editionId": "gallen-kallela-kallela-kirja-i.fi.gutenberg",
    "editionPublicationYear": 1924,
    "kind": "original",
    "language": "fi",
    "title": "Kallela-kirja I : $b Iltapuhde-jutelmia"
  },
  "genres": [
    "Biography",
    "Non-fiction"
  ],
  "publish": {
    "assetVersion": 1
  },
  "rights": {
    "basis": [
      "author died 1931: more than 70 years ago in every life-plus-70 jurisdiction",
      "edition printed 1924 (imprint recorded by Project Gutenberg): more than 95 years ago (US term expired)"
    ],
    "evidence": [
      "https://www.gutenberg.org/ebooks/79251",
      "https://en.wikipedia.org/wiki/Akseli_Gallen-Kallela"
    ],
    "jurisdictions": [
      "worldwide-conservative"
    ],
    "notes": "Batch import: death years from the provider agent records and Wikidata, publication year from the cited Wikidata item or the imprint recorded by the provider; checked by the rights policy in tools/lib/src/rights_policy.dart.",
    "statement": "Public domain worldwide. Akseli Gallen-Kallela died in 1931 and the edition digitised by Project Gutenberg was printed in 1924. Project Gutenberg boilerplate removed; the Project Gutenberg edition is the source.",
    "status": "public-domain",
    "verifiedAt": "2026-09-21",
    "verifiedBy": "arkanmgerges"
  },
  "schemaVersion": 1,
  "source": {
    "format": "epub",
    "identifier": "79251",
    "provider": "gutenberg",
    "retrievedAt": "2026-09-21T03:03:56.239506Z",
    "revision": "Mon, 31 Aug 2026 12:54:29 GMT",
    "url": "https://www.gutenberg.org/ebooks/79251"
  },
  "work": {
    "author": {
      "birthYear": 1865,
      "deathYear": 1931,
      "name": "Akseli Gallen-Kallela",
      "wikidata": "Q170068"
    },
    "originalLanguage": "fi",
    "originalTitle": "Kallela-kirja I : $b Iltapuhde-jutelmia",
    "workId": "gallen-kallela-kallela-kirja-i"
  }
}
