{
  "asset": {
    "assetVersion": 1,
    "builtAt": "2026-09-21T06:22:46.353716Z",
    "chapterCount": 11,
    "contentSha256": "dadcb8ff992d65414ce70cf6ab695b88b7c92f68e97ad5f49a72f095198bd340",
    "normalizerVersion": "0.2.0",
    "path": "books/de/hoffmann-die-elixiere-des-teufels.de.gutenberg/v1/book.json.gz",
    "sha256": "717e5617cdac6e00e025cdfa23858961cae2d4a7a289760df4823f1c33d755c7",
    "sizeBytes": 259475,
    "uncompressedSizeBytes": 707945,
    "wordCount": 108852
  },
  "edition": {
    "editionId": "hoffmann-die-elixiere-des-teufels.de.gutenberg",
    "kind": "original",
    "language": "de",
    "title": "Die Elixiere des Teufels : $b Nachgelassene Papiere des Bruders Medardus, eines Kapuziners"
  },
  "genres": [
    "Fiction",
    "Science"
  ],
  "publish": {
    "assetVersion": 1
  },
  "rights": {
    "basis": [
      "author died 1822: more than 70 years ago in every life-plus-70 jurisdiction",
      "first published 1815: more than 95 years ago (US term expired)"
    ],
    "evidence": [
      "https://www.gutenberg.org/ebooks/76360",
      "https://en.wikipedia.org/wiki/E.T.A._Hoffmann",
      "https://de.wikipedia.org/wiki/E._T._A._Hoffmann",
      "https://www.wikidata.org/wiki/Q600849"
    ],
    "jurisdictions": [
      "worldwide-conservative"
    ],
    "notes": "Batch import: death years from the provider agent records and Wikidata, publication year from the cited Wikidata item or the imprint recorded by the provider; checked by the rights policy in tools/lib/src/rights_policy.dart.",
    "statement": "Public domain worldwide. E. T. A. Hoffmann died in 1822 and the work was first published in 1815. Project Gutenberg boilerplate removed; the Project Gutenberg edition is the source.",
    "status": "public-domain",
    "verifiedAt": "2026-09-21",
    "verifiedBy": "arkanmgerges"
  },
  "schemaVersion": 1,
  "source": {
    "format": "epub",
    "identifier": "76360",
    "provider": "gutenberg",
    "retrievedAt": "2026-09-21T02:25:15.655095Z",
    "revision": "Sun, 30 Aug 2026 13:34:53 GMT",
    "url": "https://www.gutenberg.org/ebooks/76360"
  },
  "work": {
    "author": {
      "birthYear": 1776,
      "deathYear": 1822,
      "name": "E. T. A. Hoffmann",
      "wikidata": "Q150471"
    },
    "originalLanguage": "de",
    "originalPublicationYear": 1815,
    "originalTitle": "Die Elixiere des Teufels : $b Nachgelassene Papiere des Bruders Medardus, eines Kapuziners",
    "workId": "hoffmann-die-elixiere-des-teufels"
  }
}
